{
  "$schema": "http://json-schema.org/draft-07/schema#",
  "title": "PitCrew runner profile",
  "type": "object",
  "additionalProperties": false,
  "required": [
    "schemaVersion",
    "name",
    "description",
    "image",
    "labels",
    "replicas"
  ],
  "definitions": {
    "externalVolume": {
      "type": "object",
      "additionalProperties": false,
      "required": ["name", "source"],
      "properties": {
        "name": {
          "type": "string",
          "pattern": "^[a-z][a-z0-9-]{0,31}$"
        },
        "source": {
          "type": "string",
          "pattern": "^[a-zA-Z0-9][a-zA-Z0-9_.-]{0,127}$"
        }
      }
    }
  },
  "properties": {
    "$schema": {
      "type": "string"
    },
    "schemaVersion": {
      "const": 1
    },
    "name": {
      "type": "string",
      "pattern": "^[a-z][a-z0-9-]{0,31}$"
    },
    "description": {
      "type": "string",
      "minLength": 1
    },
    "image": {
      "type": "string",
      "minLength": 1
    },
    "labels": {
      "type": "array",
      "uniqueItems": true,
      "items": {
        "type": "string",
        "pattern": "^[a-zA-Z0-9][a-zA-Z0-9._-]{0,62}$"
      }
    },
    "replicas": {
      "type": "integer",
      "minimum": 1
    },
    "pullImage": {
      "type": "boolean"
    },
    "disableDefaultLabels": {
      "type": "boolean"
    },
    "runnerGroup": {
      "type": "string"
    },
    "autoscaling": {
      "type": "object",
      "additionalProperties": false,
      "required": [
        "mode"
      ],
      "properties": {
        "mode": {
          "const": "scale-set"
        },
        "minimumIdle": {
          "type": "integer",
          "minimum": 0
        },
        "scaleDownDelaySeconds": {
          "type": "integer",
          "minimum": 30,
          "maximum": 3600
        },
        "maximumActiveWorkers": {
          "type": "integer",
          "minimum": 1,
          "maximum": 2147483647
        }
      }
    },
    "hostAdmission": {
      "type": "object",
      "additionalProperties": false,
      "required": [
        "namespace",
        "capacityUnits",
        "safetyMarginUnits",
        "workerCostUnits",
        "reservationUnits",
        "borrowable"
      ],
      "properties": {
        "namespace": {
          "type": "string",
          "pattern": "^[a-z][a-z0-9-]{0,31}$"
        },
        "capacityUnits": {
          "type": "integer",
          "minimum": 1,
          "maximum": 2147483647
        },
        "safetyMarginUnits": {
          "type": "integer",
          "minimum": 0,
          "maximum": 2147483647
        },
        "workerCostUnits": {
          "type": "integer",
          "minimum": 1,
          "maximum": 2147483647
        },
        "reservationUnits": {
          "type": "integer",
          "minimum": 0,
          "maximum": 2147483647
        },
        "borrowable": {
          "type": "boolean"
        }
      }
    },
    "readOnlyVolumes": {
      "type": "array",
      "maxItems": 8,
      "items": { "$ref": "#/definitions/externalVolume" }
    },
    "readWriteVolumes": {
      "type": "array",
      "maxItems": 8,
      "items": { "$ref": "#/definitions/externalVolume" }
    },
    "serviceNetwork": {
      "type": "object",
      "additionalProperties": false,
      "required": [
        "source"
      ],
      "properties": {
        "source": {
          "type": "string",
          "pattern": "^[a-zA-Z0-9][a-zA-Z0-9_.-]{0,127}$"
        }
      }
    },
    "runtime": {
      "type": "object",
      "additionalProperties": false,
      "minProperties": 1,
      "properties": {
        "docker": {
          "type": "object",
          "additionalProperties": false,
          "required": ["mode", "storage"],
          "properties": {
            "mode": { "const": "privileged-local" },
            "storage": {
              "type": "string",
              "pattern": "^[0-9]+(?:[bBkKmMgGtT]|[kKmMgGtT][bBiI]|[kKmMgGtT][iI][bB])?$"
            }
          }
        },
        "devices": {
          "type": "array",
          "minItems": 1,
          "maxItems": 1,
          "uniqueItems": true,
          "items": {
            "enum": [
              "kvm"
            ]
          }
        },
        "sharedMemory": {
          "type": "string",
          "pattern": "^[0-9]+(?:[bBkKmMgGtT]|[kKmMgGtT][bBiI]|[kKmMgGtT][iI][bB])?$"
        }
      }
    },
    "resources": {
      "type": "object",
      "additionalProperties": false,
      "minProperties": 1,
      "dependencies": {
        "memorySwap": [
          "memory"
        ]
      },
      "properties": {
        "memory": {
          "type": "string",
          "pattern": "^[0-9]+(?:[bBkKmMgGtT]|[kKmMgGtT][bBiI]|[kKmMgGtT][iI][bB])?$"
        },
        "memorySwap": {
          "type": "string",
          "pattern": "^[0-9]+(?:[bBkKmMgGtT]|[kKmMgGtT][bBiI]|[kKmMgGtT][iI][bB])?$"
        },
        "cpus": {
          "type": "string",
          "pattern": "^[0-9]+(?:\\.[0-9]{1,9})?$"
        },
        "pids": {
          "type": "integer",
          "minimum": 1,
          "maximum": 2147483647
        }
      }
    },
    "verificationCommands": {
      "type": "array",
      "items": {
        "type": "string",
        "minLength": 1
      }
    },
    "build": {
      "type": "object",
      "additionalProperties": false,
      "required": [
        "context",
        "dockerfile"
      ],
      "properties": {
        "context": {
          "type": "string",
          "minLength": 1
        },
        "dockerfile": {
          "type": "string",
          "minLength": 1
        },
        "args": {
          "type": "object",
          "additionalProperties": {
            "type": "string"
          }
        }
      }
    }
  }
}
